{
  "schema": "elyne.eval.probe-catalog/v1",
  "id": "justesse",
  "revision": 1,
  "status": "accepted",
  "fixture_schemas": ["elyne.eval.fixture-justesse/v1"],
  "isolation": {
    "source_access": "read-only",
    "snapshot_access": "read-only",
    "external_artifacts_access": "read-only",
    "work_dir_access": "read-write",
    "network_access": "public-https-policy",
    "process_spawn": "driver-owned-only"
  },
  "probes": [
    {
      "id": "justesse.answer",
      "phase": "running",
      "handler_id": "probe-handler.justesse.answer",
      "fixture_schema": "elyne.eval.fixture-justesse/v1",
      "case_types": ["judge", "objective", "tool"],
      "timeout_seconds": 3600,
      "evidence": [
        {"id": "case-result", "media_type": "application/json", "required_when": "always"},
        {"id": "surfaced-information", "media_type": "application/json", "required_when": "always"},
        {"id": "tool-call-trace", "media_type": "application/json", "required_when": "always"}
      ]
    }
  ]
}
